{
  "schema": "worker-result.runner/1",
  "ssot_id": "e2e-read-04c9d864d719",
  "task_id": "e2e-read_only",
  "slice_id": "runner-01",
  "status": "done",
  "summary": "Validated schema and fixture status, then proposed a follow-up write ticket.",
  "evidence": {
    "analysis": [
      "The follow-up builder handoff can stay scoped to dev/multi-agent/e2e/ and still close the fixture drift."
    ],
    "commands": [
      {
        "cmd": "python3 dev/multi-agent/e2e/run_smoke.py",
        "cwd": "<repo_root>",
        "exit_code": 0,
        "stdout_excerpt": "OK: e2e fixtures + invariants"
      }
    ],
    "files_read": [
      "multi-agent/PLAYBOOK.md",
      "dev/multi-agent/e2e/validate_payloads.py"
    ]
  },
  "next_actions": [
    "Dispatch builder slice for fixture updates."
  ],
  "handoff_requests": [
    {
      "schema": "task-dispatch/1",
      "ssot_id": "e2e-read-04c9d864d719",
      "task_id": "e2e-read_only",
      "slice_id": "builder-11",
      "agent_type": "builder",
      "slice_kind": "work",
      "work_package_id": "pkg-runner-handoff-builder-11",
      "timebox_minutes": 10,
      "ownership_paths": [
        "dev/multi-agent/e2e/"
      ],
      "dependencies": [
        "runner-01"
      ],
      "task_contract": {
        "goal": "Apply agreed fixture updates and rerun smoke validation.",
        "acceptance": [
          "Updated fixtures validate under current schemas."
        ],
        "constraints": [
          "Only edit owned paths.",
          "No unrelated file changes."
        ]
      },
      "evidence_requirements": [
        "diff",
        "verification"
      ]
    }
  ],
  "agent_type": "runner"
}
